URL_ID,Version,Published,Updated,Title,Match,Categories
2008.09195,1,2020-08-20,2020-08-20,Fluorescence fluctuations-based super-resolution microscopy techniques: an experimental comparative study,comparative study,"eess.IV, q-bio.QM"
2008.13527,1,2020-08-20,2020-08-20,Review Regularized Neural Collaborative Filtering,Review,"cs.IR, cs.LG, stat.ML"
2008.09017,1,2020-08-20,2020-08-20,A summary of the prevalence of Genetic Algorithms in Bioinformatics from 2015 onwards,summary of,"cs.NE, cs.LG"
2008.08879,1,2020-08-20,2020-08-20,A comparative study of similarity-based and GNN-based link prediction approaches,comparative study,"cs.SI, cs.LG"
1912.02461,3,2019-12-05,2020-08-20,Towards Robust Neural Vocoding for Speech Generation: A Survey,Survey,"cs.SD, cs.LG, eess.AS"
2008.06365,3,2020-08-12,2020-08-19,An Overview of Deep Learning Architectures in Few-Shot Learning Domain,Overview,"cs.CV, cs.LG"
2003.00646,2,2020-03-02,2020-08-19,A review of machine learning applications in wildfire science and management,review,"cs.LG, stat.ML"
1812.05944,3,2018-12-14,2020-08-19,"A Tutorial on Distance Metric Learning: Mathematical Foundations, Algorithms, Experimental Analysis, Prospects and Challenges (with Appendices on Mathematical Background and Detailed Algorithms Explanation)",Foundations,"cs.LG, stat.ML"
2008.07617,2,2020-08-08,2020-08-19,Comparative study of variational quantum circuit and quantum backpropagation multilayer perceptron for COVID-19 outbreak predictions,Comparative study,"quant-ph, cs.LG"
2008.08264,1,2020-08-19,2020-08-19,Intelligent Radio Signal Processing: A Contemporary Survey,Survey,"eess.SP, cs.AI, cs.IT, cs.NI, math.IT"
2008.08221,1,2020-08-19,2020-08-19,Machine Learning for Reliability Engineering and Safety Applications: Review of Current Status and Future Opportunities,Review,"cs.LG, stat.ML"
2008.07324,2,2020-08-13,2020-08-18,Intelligence Primer,Primer,"cs.AI, cs.LG"
2008.07664,1,2020-08-17,2020-08-17,Privacy-preserving feature selection: A survey and proposing a new set of protocols,survey,"cs.CR, 68P27, cs.LG"
2008.07267,1,2020-08-17,2020-08-17,A Survey of Active Learning for Text Classification using Deep Neural Networks,Survey,"cs.CL, cs.LG"
2008.07235,1,2020-08-17,2020-08-17,A Survey of Deep Learning for Data Caching in Edge Network,Survey,"cs.NI, cs.LG"
2008.07125,1,2020-08-17,2020-08-17,Adversarial EXEmples: A Survey and Experimental Evaluation of Practical Attacks on Machine Learning for Windows Malware Detection,Survey,"cs.CR, cs.LG"
2008.06853,1,2020-08-16,2020-08-16,Geometric Foundations of Data Reduction,Foundations,"cs.LG, I.2, cs.NA, math.NA, stat.ML"
2008.06727,1,2020-08-15,2020-08-15,A Review on Drivers Red Light Running and Turning Behaviour Prediction,Review,"cs.AI, cs.CY, cs.NE"
2008.06723,1,2020-08-15,2020-08-15,Personality in Healthcare Human Robot Interaction (H-HRI): A Literature Review and Brief Critique,Review,"cs.CY, cs.AI, cs.HC, cs.RO"
2001.08236,2,2020-01-22,2020-08-14,"Search-Based Software Engineering for Self-Adaptive Systems: Survey, Disappointments, Suggestions and Opportunities",Survey,"cs.SE, cs.AI"
2008.06580,1,2020-08-14,2020-08-14,Adaptation Algorithms for Speech Recognition: An Overview,Overview,"eess.AS, cs.CL, cs.SD"
2004.05993,2,2020-04-13,2020-08-14,A Survey of Single-Scene Video Anomaly Detection,Survey,cs.CV
2008.06353,1,2020-08-14,2020-08-14,Survey of XAI in digital pathology,Survey,"cs.CV, cs.LG, eess.IV"
2008.05972,1,2020-08-13,2020-08-13,A Survey on Knowledge integration techniques with Artificial Neural Networks for seq-2-seq/time series models,Survey,"cs.LG, cs.AI, cs.CL"
2008.05221,2,2020-08-12,2020-08-13,Compression of Deep Learning Models for Text: A Survey,Survey,"cs.CL, cs.AI, cs.CV, cs.LG"
2008.05756,1,2020-08-13,2020-08-13,Metrics for Multi-Class Classification: an Overview,Overview,"stat.ML, cs.LG"
2008.05850,1,2020-08-12,2020-08-12,Revealing the Hidden Patterns: A Comparative Study on Profiling Subpopulations of MOOC Students,Comparative Study,"cs.HC, cs.LG"
2008.04970,1,2020-08-11,2020-08-11,Metaheuristics for the operating theater planning and scheduling: A systematic review,review,"cs.AI, math.OC"
2008.04855,1,2020-08-11,2020-08-11,Common Metrics to Benchmark Human-Machine Teams (HMT): A Review,Review,"cs.CY, cs.HC, cs.LG, cs.RO, cs.SY, eess.SY"
1907.07374,5,2019-07-17,2020-08-11,A Survey on Explainable Artificial Intelligence (XAI): Towards Medical XAI,Survey,"cs.LG, cs.AI"
1910.11377,4,2019-10-24,2020-08-10,Clinical Concept Extraction: a Methodology Review,Review,"cs.IR, cs.CL"
2008.04379,1,2020-08-10,2020-08-10,A Survey and Insights on Deployments of the Connected and Autonomous Vehicles in US,Survey,"cs.CY, cs.LG"
2008.04277,1,2020-08-10,2020-08-10,SemEval-2020 Task 9: Overview of Sentiment Analysis of Code-Mixed Tweets,Overview,cs.CL
2008.03964,1,2020-08-10,2020-08-10,DQI: A Guide to Benchmark Evaluation,Guide,"cs.CL, cs.CV, cs.LG, cs.SY, eess.SY"
2008.03911,1,2020-08-10,2020-08-10,A Survey on Large-scale Machine Learning,Survey,"cs.LG, stat.ML"
2008.13538,1,2020-08-10,2020-08-10,Scientific Paper Recommendation: A Survey,Survey,cs.IR
2008.03639,1,2020-08-09,2020-08-09,Random Walks: A Review of Algorithms and Applications,Review,"cs.SI, cs.LG, physics.data-an"
2008.03638,1,2020-08-09,2020-08-09,Big Networks: A Survey,Survey,"cs.SI, cs.LG, physics.data-an"
2008.04815,1,2020-08-09,2020-08-09,A Review on Deep Learning Techniques for the Diagnosis of Novel Coronavirus (COVID-19),Review,"eess.IV, cs.CV, cs.LG"
1904.08405,3,2019-04-17,2020-08-08,Event-based Vision: A Survey,Survey,"cs.CV, cs.AI, cs.LG, cs.RO"
2006.05822,2,2020-06-10,2020-08-08,Description and Discussion on DCASE2020 Challenge Task2: Unsupervised Anomalous Sound Detection for Machine Condition Monitoring,Discussion,"eess.AS, cs.LG, cs.SD, stat.ML"
1909.00384,2,2019-09-01,2020-08-08,DeepHealth: Review and challenges of artificial intelligence in health informatics,Review,"cs.LG, cs.CV, eess.IV, stat.ML"
2008.03426,1,2020-08-08,2020-08-08,Recent Advances and New Guidelines on Hyperspectral and Multispectral Image Fusion,Guidelines,"eess.IV, cs.CV"
2008.01499,2,2020-08-04,2020-08-07,"Distributed Linguistic Representations in Decision Making: Taxonomy, Key Elements and Applications, and Challenges in Data Science and Explainable Artificial Intelligence",Taxonomy,cs.AI
2008.04103,1,2020-08-07,2020-08-07,Review of Swarm Intelligence-based Feature Selection Methods,Review,"cs.LG, cs.NE, stat.ML"
2008.08118,1,2020-08-06,2020-08-06,Review of Machine Learning Algorithms for Brain Stroke Diagnosis and Prognosis by EEG Analysis,Review,"eess.SP, cs.LG"
1901.10408,2,2019-01-29,2020-08-06,Guidelines for creating man-machine multimodal interfaces,Guidelines,"cs.CL, cs.HC"
2004.11829,5,2020-04-24,2020-08-06,A survey on domain adaptation theory: learning bounds and theoretical guarantees,survey,"cs.LG, stat.ML"
2008.02627,1,2020-08-06,2020-08-06,Notes on the Behavior of MC Dropout,Notes on,"cs.LG, stat.ML"
1911.08916,2,2019-11-20,2020-08-06,Deep Learning based HEp-2 Image Classification: A Comprehensive Review,Review,cs.CV
2008.02429,1,2020-08-06,2020-08-06,Foundations of Reasoning with Uncertainty via Real-valued Logics,Foundations,"cs.LO, cs.AI"
2008.13541,1,2020-08-05,2020-08-05,Introductory review to quantum information retrieval,review,"cs.IR, quant-ph"
2006.11220,2,2020-06-19,2020-08-05,"Localized Spectral Graph Filter Frames: A Unifying Framework, Survey of Design Considerations, and Numerical Comparison (Extended Cut)",Survey,"eess.SP, cs.LG, cs.SI"
2007.09815,3,2020-07-19,2020-08-04,Event Prediction in the Big Data Era: A Systematic Survey,Survey,"cs.AI, cs.CY"
2006.12559,2,2020-06-22,2020-08-04,Artificial Intelligence-Assisted Energy and Thermal Comfort Control for Sustainable Buildings: An Extended Representation of the Systematic Review,Review,"eess.SP, cs.CY, cs.LG"
2008.01466,1,2020-08-04,2020-08-04,Taking Notes on the Fly Helps BERT Pre-training,Notes on,cs.CL
2008.01391,1,2020-08-04,2020-08-04,A Survey of Orthographic Information in Machine Translation,Survey,cs.CL
2008.01305,1,2020-08-04,2020-08-04,A User Guide to Low-Pass Graph Signal Processing and its Applications,Guide,"eess.SP, stat.ML"
2008.07449,1,2020-08-03,2020-08-03,A Survey on the Use of AI and ML for Fighting the COVID-19 Pandemic,Survey,"cs.LG, cs.AI, cs.CY"
2008.00842,1,2020-08-03,2020-08-03,A Survey on the Evolution of Stream Processing Systems,Survey,"cs.DC, cs.CL, cs.DB, cs.PF"
1912.13171,4,2019-12-31,2020-08-03,Deep Learning on Image Denoising: An overview,overview,"eess.IV, cs.CV"
2007.10760,3,2020-07-21,2020-08-02,Backdoor Attacks and Countermeasures on Deep Learning: A Comprehensive Review,Review,"cs.CR, cs.CV, cs.LG"
2008.00380,1,2020-08-02,2020-08-02,Vision and Inertial Sensing Fusion for Human Action Recognition : A Review,Review,"cs.HC, cs.CV, cs.LG"
2006.03669,2,2020-06-05,2020-08-01,An Overview of Neural Network Compression,Overview,"cs.LG, stat.ML"
1804.06655,9,2018-04-18,2020-08-01,Deep Face Recognition: A Survey,Survey,cs.CV
2008.02072,1,2020-07-31,2020-07-31,A Comparative study of Artificial Neural Networks Using Reinforcement learning and Multidimensional Bayesian Classification Using Parzen Density Estimation for Identification of GC-EIMS Spectra of Partially Methylated Alditol Acetates,Comparative study,"eess.SP, cs.LG, cs.NE, q-bio.BM"
2007.16061,1,2020-07-31,2020-07-31,Graph signal processing for machine learning: A review and new perspectives,perspectives,"cs.LG, cs.SI, eess.SP, stat.ML"
1907.02704,3,2019-07-05,2020-07-31,Extraction and Analysis of Fictional Character Networks: A Survey,Survey,"cs.SI, cs.CL, cs.CV, cs.IR, cs.MM"
2007.15264,2,2020-07-30,2020-07-31,Learning what they think vs. learning what they do: The micro-foundations of vicarious learning,foundations,"econ.TH, cs.AI"
2006.12057,2,2020-06-22,2020-07-31,Differentiable Rendering: A Survey,Survey,"cs.CV, cs.GR"
2008.01004,1,2020-07-30,2020-07-30,Identification of 1H-NMR Spectra of Xyloglucan Oligosaccharides: A Comparative Study of Artificial Neural Networks and Bayesian Classification Using Nonparametric Density Estimation,Comparative Study,"q-bio.BM, cs.NE"
1908.09574,3,2019-08-26,2020-07-30,Improvability Through Semi-Supervised Learning: A Survey of Theoretical Results,Survey,"cs.LG, stat.ML"
2007.15484,1,2020-07-30,2020-07-30,Learning from Few Samples: A Survey,Survey,cs.CV
2007.10237,3,2020-07-20,2020-07-30,Learning from Data to Speed-up Sorted Table Search Procedures: Methodology and Practical Guidelines,Guidelines,"cs.LG, cs.DS, stat.ML"
2008.07343,1,2020-07-30,2020-07-30,Artificial Intelligence in the Battle against Coronavirus (COVID-19): A Survey and Future Research Directions,Survey,"cs.CY, cs.AI, cs.LG"
2007.15221,1,2020-07-30,2020-07-30,Swarm Intelligence for Next-Generation Wireless Networks: Recent Advances and Applications,Recent Advances,"cs.NI, cs.AI"
2007.10737,3,2020-07-21,2020-07-29,A Comprehensive Review of Skeleton-based Movement Assessment Methods,Review,cs.CV
2007.15129,1,2020-07-29,2020-07-29,Integrating Machine Learning for Planetary Science: Perspectives for the Next Decade,Perspectives,"astro-ph.IM, astro-ph.EP, stat.ML"
2003.02822,4,2020-03-05,2020-07-29,Feature Extraction for Hyperspectral Imagery: The Evolution from Shallow to Deep (Overview and Toolbox),Overview,"cs.CV, cs.LG, eess.IV"
2008.04059,1,2020-07-28,2020-07-28,Supervised Machine Learning Techniques: An Overview with Applications to Banking,Overview,"q-fin.GN, cs.LG, stat.ML"
1909.11573,2,2019-09-25,2020-07-28,Deep Learning for Deepfakes Creation and Detection: A Survey,Survey,"cs.CV, cs.LG, eess.IV"
2007.16063,1,2020-07-28,2020-07-28,A Review on the State of the Art in Non Contact Sensing for COVID-19,Review,"cs.CY, eess.IV, physics.med-ph"
2007.10785,3,2020-07-16,2020-07-27,Automated Detection and Forecasting of COVID-19 using Deep Learning Techniques: A Review,Review,"cs.LG, eess.IV"
2007.14215,1,2020-07-27,2020-07-27,A Review on Computational Intelligence Techniques in Cloud and Edge Computing,Review,"cs.DC, cs.AI, eess.SP"
2007.13241,1,2020-07-26,2020-07-26,Beyond the Worst-Case Analysis of Algorithms (Introduction),Introduction,"cs.DS, stat.ML"
2007.01276,2,2020-07-02,2020-07-26,Epileptic seizure detection using deep learning techniques: A Review,Review,"cs.LG, eess.SP, stat.ML"
2007.01285,3,2020-07-02,2020-07-26,Deep Learning for Neuroimaging-based Diagnosis and Rehabilitation of Autism Spectrum Disorder: A Review,Review,"cs.LG, eess.IV, stat.ML"
2007.13069,1,2020-07-26,2020-07-26,A Survey on Complex Question Answering over Knowledge Base: Recent Advances and Challenges,Recent Advances,"cs.CL, cs.HC"
2007.13058,1,2020-07-26,2020-07-26,Do recommender systems function in the health domain: a system review,review,"cs.IR, 68U35, H.4.0, cs.CL, cs.LG"
2006.05245,2,2020-06-09,2020-07-26,A Review of Automated Diagnosis of COVID-19 Based on Scanning Images,Review,"eess.IV, cs.CV, cs.LG"
2008.00088,1,2020-07-24,2020-07-24,A Comparative Study of AI-based Intrusion Detection Techniques in Critical Infrastructures,Comparative Study,"cs.NI, cs.DC, cs.LG"
2007.12674,1,2020-07-24,2020-07-24,Controlling Privacy Loss in Survey Sampling (Working Paper),Survey,"stat.ME, cs.CR, cs.LG"
2007.12374,1,2020-07-24,2020-07-24,A Survey on Graph Neural Networks for Knowledge Graph Completion,Survey,"cs.CL, cs.AI, cs.LG"
1912.11676,2,2019-12-25,2020-07-23,Deep Learning-based Vehicle Behaviour Prediction For Autonomous Driving Applications: A Review,Review,"cs.CV, cs.LG, cs.RO, stat.ML"
1904.00784,3,2019-03-25,2020-07-22,A Survey of Code-switched Speech and Language Processing,Survey,"cs.CL, cs.LG, stat.ML"
2007.11572,1,2020-07-22,2020-07-22,Complex Sequential Data Analysis: A Systematic Literature Review of Existing Algorithms,Review,"cs.LG, I.2.6, stat.ML"
2007.00095,2,2020-06-30,2020-07-22,Deep Learning for Vision-based Prediction: A Survey,Survey,"cs.CV, cs.LG, cs.RO"
2007.09479,2,2020-07-18,2020-07-21,Deep Learning Based Brain Tumor Segmentation: A Survey,Survey,"eess.IV, cs.CV"
2007.12261,1,2020-07-21,2020-07-21,Short-term forecasting COVID-19 cumulative confirmed cases: Perspectives for Brazil,Perspectives,"q-bio.PE, cs.LG"
2007.06622,3,2020-07-13,2020-07-21,SoK: The Faults in our ASRs: An Overview of Attacks against Automatic Speech Recognition and Speaker Identification Systems,Overview,"cs.CR, cs.LG, cs.SD"
2007.10903,1,2020-07-21,2020-07-21,Conformance checking: A state-of-the-art literature review,review,"cs.SE, cs.IR"
2007.09774,1,2020-07-19,2020-07-19,An Overview of Natural Language State Representation for Reinforcement Learning,Overview,cs.CL
2007.09637,1,2020-07-19,2020-07-19,Survey on Deep Learning-based Kuzushiji Recognition,Survey,cs.CV
2007.09604,1,2020-07-19,2020-07-19,Meta-learning for Few-shot Natural Language Processing: A Survey,Survey,"cs.CL, cs.LG"
2007.09513,1,2020-07-18,2020-07-18,Feature-level Rating System using Customer Reviews and Review Votes,Review,"cs.CL, cs.SI"
2008.04073,1,2020-07-18,2020-07-18,AI Failures: A Review of Underlying Issues,Review,"cs.CY, cs.AI"
2007.06686,2,2020-07-13,2020-07-18,A Systematic Survey on Deep Generative Models for Graph Generation,Survey,"cs.LG, stat.ML"
1812.00315,2,2018-12-02,2020-07-17,"A Survey of Fake News: Fundamental Theories, Detection Methods, and Opportunities",Survey,"cs.CL, cs.AI, cs.SI"
2007.10818,1,2020-07-17,2020-07-17,"A Review of Meta-level Learning in the Context of Multi-component, Multi-level Evolving Prediction Systems",Review,cs.LG
2007.08911,1,2020-07-17,2020-07-17,Technologies for Trustworthy Machine Learning: A Survey in a Socio-Technical Context,Survey,"cs.LG, cs.AI, cs.CR, cs.CY, stat.ML"
2007.08781,1,2020-07-17,2020-07-17,Mixing Real and Synthetic Data to Enhance Neural Network Training -- A Review of Current Approaches,Review,"cs.CV, cs.LG"
2001.06303,2,2020-01-16,2020-07-16,"Vision Meets Drones: Past, Present and Future",Present and Future,cs.CV
2007.10781,1,2020-07-16,2020-07-16,Data Stream Clustering: A Review,Review,"cs.LG, 68T05, I.2.0, cs.AI, cs.DB, stat.ML"
2004.10664,2,2020-04-22,2020-07-16,A review: Deep learning for medical image segmentation using multi-modality fusion,review,"eess.IV, cs.CV, cs.LG, stat.ML"
2007.08024,1,2020-07-15,2020-07-15,A Survey on Computational Propaganda Detection,Survey,"cs.CL, 68T50, I.2.7, cs.IR, cs.LG"
2007.07997,1,2020-07-15,2020-07-15,Overview of CheckThat! 2020: Automatic Identification and Verification of Claims in Social Media,Overview,"cs.CL, 68T50, I.2.7, cs.IR, cs.LG"
2008.07275,1,2020-07-15,2020-07-15,"Facial Recognition: A cross-national Survey on Public Acceptance, Privacy, and Discrimination",Survey,"cs.CY, cs.CV, cs.LG, stat.ML"
2007.07646,1,2020-07-15,2020-07-15,A Survey of Privacy Attacks in Machine Learning,Survey,"cs.CR, cs.LG"
1707.02038,3,2017-07-07,2020-07-14,A Tutorial on Thompson Sampling,Tutorial,cs.LG
1812.10528,3,2018-12-26,2020-07-14,Adversarial Attack and Defense on Graph Data: A Survey,Survey,"cs.CR, cs.AI, cs.SI"
2007.06915,1,2020-07-14,2020-07-14,Questionnaire analysis to define the most suitable survey for port-noise investigation,survey,"cs.CL, cs.CY"
2007.06823,1,2020-07-14,2020-07-14,Hands-on Bayesian Neural Networks -- a Tutorial for Deep Learning Users,Tutorial,"cs.LG, stat.ML"
2007.12769,1,2020-07-14,2020-07-14,A unified survey on treatment effect heterogeneity modeling and uplift modeling,survey,"stat.ME, cs.LG, stat.AP, stat.ML"
2007.06758,1,2020-07-14,2020-07-14,Recommender Systems for the Internet of Things: A Survey,Survey,"cs.IR, cs.LG, stat.ML"
2003.04919,4,2020-03-10,2020-07-14,Integrating Physics-Based Modeling with Machine Learning: A Survey,Survey,"physics.comp-ph, A.1, cs.LG, stat.ML"
2007.06700,1,2020-07-13,2020-07-13,Revisiting Fundamentals of Experience Replay,Fundamentals,"cs.LG, stat.ML"
2007.06617,1,2020-07-13,2020-07-13,"A comparative study of forecasting Corporate Credit Ratings using Neural Networks, Support Vector Machines, and Decision Trees",comparative study,"q-fin.RM, cs.LG"
2005.11081,2,2020-05-22,2020-07-13,Learning Combinatorial Optimization on Graphs: A Survey with Applications to Networking,Survey,"cs.LG, A.1, cs.AI, stat.ML"
2004.06448,2,2020-04-14,2020-07-13,Measurement Error in Nutritional Epidemiology: A Survey,Survey,"stat.ME, cs.LG, stat.ML"
2007.06071,1,2020-07-12,2020-07-12,A Comparative Study on Polyp Classification using Convolutional Neural Networks,Comparative Study,cs.CV
2007.05976,1,2020-07-12,2020-07-12,Stance Detection in Web and Social Media: A Comparative Study,Comparative Study,"cs.CL, cs.LG"
2007.01992,2,2020-07-04,2020-07-12,A Survey on Sensor Technologies for Unmanned Ground Vehicles,Survey,"cs.CV, cs.RO"
2007.05881,1,2020-07-12,2020-07-12,Applying recent advances in Visual Question Answering to Record Linkage,recent advances,"cs.LG, cs.AI, cs.DB, stat.ML"
2005.02979,2,2020-05-06,2020-07-11,A Survey of Algorithms for Black-Box Safety Validation,Survey,"cs.LG, cs.AI, cs.SY, eess.SY, stat.ML"
2007.05800,1,2020-07-11,2020-07-11,A Tutorial on Graph Theory for Brain Signal Analysis,Tutorial,"q-bio.NC, cs.LG, eess.SP"
2007.05683,1,2020-07-11,2020-07-11,Batch-level Experience Replay with Review for Continual Learning,Review,"cs.LG, cs.AI, cs.CV, stat.ML"
2007.05156,1,2020-07-10,2020-07-10,A Survey on Autonomous Vehicle Control in the Era of Mixed-Autonomy: From Physics-Based to AI-Guided Driving Policy Learning,Survey,"cs.AI, cs.RO"
2007.04782,1,2020-07-09,2020-07-09,A Systematic Review on Context-Aware Recommender Systems using Deep Learning and Embeddings,Review,"cs.IR, cs.CV"
2007.02725,2,2020-07-03,2020-07-09,The FMRIB Variational Bayesian Inference Tutorial II: Stochastic Variational Bayes,Tutorial,"stat.ME, cs.LG"
1208.6335,2,2012-08-30,2020-07-09,Comparative Study and Optimization of Feature-Extraction Techniques for Content based Image Retrieval,Comparative Study,"cs.CV, cs.AI, cs.IR, cs.LG, cs.MM"
2007.04357,1,2020-07-08,2020-07-08,A Survey of Quantum Theory Inspired Approaches to Information Retrieval,Survey,cs.IR
2007.05038,1,2020-07-08,2020-07-08,A Quick Review on Recent Trends in 3D Point Cloud Data Compression Techniques and the Challenges of Direct Processing in 3D Compressed Domain,Review,"cs.CV, cs.RO, eess.IV"
1908.00709,5,2019-08-02,2020-07-08,AutoML: A Survey of the State-of-the-Art,Survey,"cs.LG, cs.CV, stat.ML"
2007.04100,1,2020-07-07,2020-07-07,A Survey of Real-Time Social-Based Traffic Detection,Survey,"cs.SI, cs.LG"
2007.02759,2,2020-07-06,2020-07-07,Intelligent Reflecting Surface Aided Wireless Communications: A Tutorial,Tutorial,"cs.IT, cs.LG, cs.NI, math.IT"
2006.05278,2,2020-06-09,2020-07-06,An Overview of Deep Semi-Supervised Learning,Overview,"cs.LG, stat.ML"
2007.12586,1,2020-07-06,2020-07-06,Introduction to Behavior Algorithms for Fighting Games,Introduction,cs.AI
2007.02202,1,2020-07-04,2020-07-04,A Survey on Applications of Artificial Intelligence in Fighting Against COVID-19,Survey,"q-bio.QM, cs.LG"
2004.11154,3,2020-04-23,2020-07-04,"Random Features for Kernel Approximation: A Survey on Algorithms, Theory, and Beyond",Survey,"stat.ML, cs.LG"
2006.06091,3,2020-06-10,2020-07-04,Autonomous Driving with Deep Learning: A Survey of State-of-Art Technologies,Survey,cs.CV
2004.06286,4,2020-04-13,2020-07-03,Transfer Learning for EEG-Based Brain-Computer Interfaces: A Review of Progress Made Since 2016,Review,"cs.HC, cs.LG, eess.SP"
2007.00753,2,2020-07-01,2020-07-03,Opportunities and Challenges in Deep Learning Adversarial Robustness: A Survey,Survey,"cs.LG, cs.AI, stat.ML"
2007.01806,1,2020-07-03,2020-07-03,Deep learning for scene recognition from visual data: a survey,survey,cs.CV
2007.01719,1,2020-07-03,2020-07-03,Ensemble Regression Models for Software Development Effort Estimation: A Comparative Study,Comparative Study,"cs.SE, cs.AI"
2003.06620,2,2020-03-14,2020-07-03,Monocular Depth Estimation Based On Deep Learning: An Overview,Overview,cs.CV
2007.01544,1,2020-07-03,2020-07-03,A Conceptual Framework for Externally-influenced Agents: An Assisted Reinforcement Learning Review,Review,"cs.AI, cs.LG, cs.MA"
2007.01429,1,2020-07-02,2020-07-02,The Global Landscape of Neural Networks: An Overview,Overview,"cs.LG, math.OC, stat.ML"
2007.01126,1,2020-07-02,2020-07-02,A Brief Review of Deep Multi-task Learning and Auxiliary Task Learning,Review,"cs.LG, cs.CV, stat.ML"
2007.00864,1,2020-07-02,2020-07-02,Hardware Acceleration of Sparse and Irregular Tensor Computations of ML Models: A Survey and Insights,Survey,"cs.AR, cs.CV, cs.DC, cs.LG, cs.NE"
2007.00800,1,2020-07-01,2020-07-01,A Survey on Self-supervised Pre-training for Sequential Transfer Learning in Neural Networks,Survey,"cs.LG, stat.ML"
2007.00541,1,2020-07-01,2020-07-01,Benchmarking for Metaheuristic Black-Box Optimization: Perspectives and Open Challenges,Perspectives,"cs.NE, cs.PF, math.OC"
2007.07217,1,2020-07-01,2020-07-01,Non-IID Recommender Systems: A Review and Framework of Recommendation Paradigm Shifting,Review,"cs.IR, cs.LG"
2005.02863,2,2020-05-05,2020-06-30,The computerization of archaeology: survey on AI techniques,survey,cs.AI
2006.04305,2,2020-06-08,2020-06-30,Text Detection and Recognition in the Wild: A Review,Review,"cs.CV, cs.LG"
2006.10273,2,2020-06-18,2020-06-30,A Tutorial on VAEs: From Bayes' Rule to Lossless Compression,Tutorial,"cs.LG, stat.ML"
2006.16993,1,2020-06-30,2020-06-30,A Comparative Study of Network Traffic Representations for Novelty Detection,Comparative Study,"cs.NI, cs.LG"
2006.16867,1,2020-06-30,2020-06-30,Boosting Deep Neural Networks with Geometrical Prior Knowledge: A Survey,Survey,"cs.CV, cs.LG"
2006.16728,1,2020-06-30,2020-06-30,Overview of Gaussian process based multi-fidelity techniques with variable relationship between fidelities,Overview,"cs.LG, stat.ML"
2006.16709,1,2020-06-30,2020-06-30,A Survey on Recent Progress in the Theory of Evolutionary Algorithms for Discrete Optimization,Survey,"cs.NE, cs.AI"
2006.16370,1,2020-06-29,2020-06-29,Classification of cancer pathology reports: a large-scale comparative study,comparative study,"cs.LG, cs.CL, eess.IV, stat.ML"
2006.12567,2,2020-06-22,2020-06-29,A Survey on Deep Learning for Localization and Mapping: Towards the Age of Spatial Machine Intelligence,Survey,"cs.CV, cs.LG, cs.RO, eess.IV"
2006.15946,1,2020-06-29,2020-06-29,GLYFE: Review and Benchmark of Personalized Glucose Predictive Models in Type-1 Diabetes,Review,"eess.SP, cs.LG, q-bio.QM"
2007.00047,1,2020-06-28,2020-06-28,A Survey on Instance Segmentation: State of the art,Survey,"cs.CV, cs.LG, eess.IV"
2003.01200,3,2020-03-02,2020-06-27,Natural Language Processing Advancements By Deep Learning: A Survey,Survey,"cs.CL, cs.AI, cs.LG"
1908.08854,3,2019-08-23,2020-06-27,Linking Points With Labels in 3D: A Review of Point Cloud Semantic Segmentation,Review,"cs.CV, cs.LG, eess.IV"
1905.04071,2,2019-05-10,2020-06-26,Survey on Evaluation Methods for Dialogue Systems,Survey,"cs.CL, cs.AI, cs.HC, cs.LG"
2006.14799,1,2020-06-26,2020-06-26,Evaluation of Text Generation: A Survey,Survey,"cs.CL, cs.LG"
1901.07387,3,2019-01-18,2020-06-25,A Recent Survey on the Applications of Genetic Programming in Image Processing,Survey,"cs.CV, cs.AI"
2006.13774,1,2020-06-24,2020-06-24,Benchmark and Best Practices for Biomedical Knowledge Graph Embeddings,Best Practices,"cs.AI, cs.CL"
2006.15069,1,2020-06-23,2020-06-23,Machine learning-based clinical prediction modeling -- A practical guide for clinicians,guide,"stat.ML, cs.CY, cs.LG"
1911.02685,3,2019-11-07,2020-06-23,A Comprehensive Survey on Transfer Learning,Survey,"cs.LG, stat.ML"
2007.04247,1,2020-06-23,2020-06-23,Neural relation extraction: a survey,survey,"cs.CL, cs.LG"
2003.07490,3,2020-03-17,2020-06-23,Recent Advances and Challenges in Task-oriented Dialog System,Recent Advances,cs.CL
1912.12033,2,2019-12-27,2020-06-23,Deep Learning for 3D Point Clouds: A Survey,Survey,"cs.CV, cs.LG, cs.RO, eess.IV"
2006.11371,2,2020-06-16,2020-06-23,Opportunities and Challenges in Explainable Artificial Intelligence (XAI): A Survey,Survey,"cs.CV, cs.AI, cs.LG"
